{   "name": "Yavin IV",
    "climate": "temperate, tropical",
    "created": "2014-12-10T11:37:19.144000Z",
    "diameter": "10200",
    "edited": "2014-12-20T20:58:18.421000Z",
    "films": [
        "https://swapi.dev/api/films/1/"
    ],
    "gravity": "1 standard",
    "orbital_period": "4818",
    "population": "1000",
    "residents": [],
    "rotation_period": "24",
    "surface_water": "8",
    "terrain": "jungle, rainforests",
    "url": "https://swapi.dev/api/planets/3/"
}